Event Type,Event Name,Location,Date,Description
Wedding,Wedding - Scott-Steele,Fuentesside,30-03-2025,Key increase area subject.
Wedding,Wedding - Gardner Inc,West Martin,25-05-2025,Surface of huge son cause agent bar clear much.
Workshop,"Workshop - Murray, Wells and Frazier",South Carol,18-05-2025,Power defense first world kind activity.
Party,Party - Lane Inc,Johnsonfort,26-07-2025,Lawyer indicate discover major huge region most.
Party,Party - Price-Miles,New Heathermouth,17-09-2025,Friend when impact back range significant.
Wedding,"Wedding - Cruz, Wilson and Lewis",New Timothy,11-01-2025,Strong have impact show professional opportunity here my middle month.
Party,"Party - Hogan, Thompson and Roberts",West Mark,16-02-2025,Bit exactly leg per reveal.
Wedding,Wedding - Russell Ltd,Trevorhaven,13-11-2025,Lay against later ask more short sit site huge against leader.
Party,Party - Cole-Simmons,West Christinabury,22-01-2025,Yeah let boy public property trial individual matter.
Conference,"Conference - Gonzalez, Schroeder and Ware",Lake Matthewberg,20-10-2025,Fact serious trial sport us.
Workshop,Workshop - Burns Group,Christinahaven,18-07-2025,Focus commercial community senior expert its.
Workshop,Workshop - Cummings-Shelton,Claytonfort,26-06-2025,Very state evening information piece continue debate far about throughout occur.
Party,Party - Gentry Inc,South Allen,16-02-2025,Heavy fact door however collection tell.
Party,"Party - Mooney, Bennett and Irwin",North Joshua,12-02-2025,Far road speak I economy two class.
Conference,Conference - Martin-Deleon,Davisville,20-01-2025,Factor education attorney action machine rock technology so brother prepare.
Party,Party - Jones and Sons,Doyleburgh,31-03-2025,Forget factor suggest standard south every exist clear investment strong.
Conference,"Conference - Stewart, Brewer and Richardson",Allisonhaven,09-12-2025,Now north less price.
Wedding,"Wedding - Mcneil, Richard and Webb",Port Calvinstad,11-11-2025,Wait difficult ok want authority century organization present agreement.
Workshop,"Workshop - Mitchell, Brown and Williams",South Angela,29-11-2025,Who tonight tax up her possible hear.
Workshop,"Workshop - Dillon, Bell and Decker",Alexanderburgh,08-01-2025,Our prepare head style what good western color executive watch.
Party,Party - Ray-Tucker,East Rogershire,30-07-2025,Argue standard wall piece.
Conference,Conference - Raymond Inc,Odonnellport,08-12-2025,Exactly clear shake hand act course.
Wedding,Wedding - Cole and Sons,New Juanland,17-01-2025,Adult fear with statement marriage involve.
Conference,Conference - Orr LLC,New Andrewfurt,08-03-2025,Knowledge lose kid letter door he just baby window.
Party,Party - Daniel Inc,Lake Nancybury,13-03-2025,Maintain specific describe father bad yard.
Wedding,"Wedding - Orr, Charles and Jackson",Danielleton,27-06-2025,These late onto old where step cultural way floor environmental.
Wedding,Wedding - Edwards Inc,North Joseph,26-12-2025,Modern eat box box respond.
Workshop,Workshop - Mitchell and Sons,Port Nancy,06-08-2025,Cultural face couple interesting prevent page raise service.
Wedding,"Wedding - Cline, Thomas and Romero",North Bob,29-08-2025,Left third billion head car former.
Workshop,Workshop - Howard-Williams,Port Jennifertown,01-02-2025,Think all walk experience.
Conference,Conference - Watson-Williams,Jenniferchester,12-10-2025,Your quickly apply past year seek benefit could card.
Party,Party - Benjamin-Ramirez,North Alexanderview,29-06-2025,Development cup research I today.
Party,"Party - Berg, Powers and Roberts",Lake Gregory,27-07-2025,Reach send sport least guy.
Conference,Conference - Escobar PLC,Gatesborough,26-07-2025,Upon affect factor bad already trade.
Conference,Conference - Rivera Ltd,Lake Williamside,22-08-2025,Discuss thus clear industry or.
Conference,Conference - Rodriguez-Rice,North Danielton,30-05-2025,Deal up deep down spend rock beautiful class opportunity.
Conference,Conference - Marquez PLC,North Gregory,25-12-2025,National she stand growth market.
Wedding,Wedding - Forbes-Bennett,South Manuelmouth,01-10-2025,Catch item police chance accept.
Workshop,Workshop - Olson Inc,Port Paigeland,13-09-2025,Charge fight industry finish suddenly almost author sit little.
Workshop,"Workshop - Johnson, Brown and Woodard",North Lauraside,01-04-2025,Industry energy ten standard collection region leader.
Workshop,Workshop - Christian Ltd,Kimberlyland,01-02-2025,Recognize debate off team all performance.
Wedding,"Wedding - Stein, Bradley and Smith",Riveraburgh,11-10-2025,Worry we bar specific politics near agency around.
Conference,Conference - Gutierrez Inc,Mooreton,06-05-2025,Notice bill woman role certain degree statement.
Conference,Conference - Faulkner PLC,West Gabriel,29-10-2025,Throw ability note business difference anything these.
Party,Party - Dillon Ltd,Lopezmouth,09-02-2025,Whether impact upon month dream miss service reason back later.
Workshop,Workshop - Wolf-Bowman,Lake Logan,12-01-2025,After pick build control senior television of moment.
Conference,"Conference - Mason, Baker and Hernandez",North Josephview,19-04-2025,Along news season apply responsibility.
Conference,Conference - Holt-Li,Peckburgh,14-07-2025,Region prevent control finally fear dog serve natural.
Party,"Party - Smith, Grant and Allen",East Karatown,19-12-2025,Down couple yeah land travel we.
Workshop,Workshop - Shelton Group,Kelleyton,30-10-2025,If explain science environmental street family administration west animal.
Wedding,Wedding - Wolfe PLC,Jenningsbury,04-09-2025,Live perhaps military seem speech management back race become play.
Conference,"Conference - Benton, Washington and Kelly",Sharonberg,11-09-2025,Night politics series that such response.
Party,Party - Carey PLC,Coopertown,12-01-2025,Crime tough visit guy listen ability listen example federal international.
Party,Party - Gonzalez PLC,Rowlandberg,17-12-2025,Response especially house learn less heavy student challenge check idea.
Party,Party - Flowers Ltd,Lake Joyce,28-09-2025,Approach dog enjoy finish bad.
Workshop,"Workshop - Sullivan, Bradley and Kennedy",Barbarachester,04-01-2025,Quickly least center though sea attack sing course.
Workshop,"Workshop - Warren, Skinner and Williams",Chadbury,06-01-2025,Visit serious purpose item similar.
Party,Party - Wells-English,Palmerburgh,12-03-2025,Suddenly Republican threat serious development low she.
Party,Party - Lopez Ltd,Port Juliachester,21-05-2025,Pull story brother treat election soon charge.
Party,Party - Moore-Turner,Kramerport,07-10-2025,Go great such reality similar bit.
Workshop,Workshop - Knight Ltd,West Lisaberg,21-04-2025,Everything program name hold mind.
Workshop,"Workshop - Hernandez, Avery and Ware",Lake Brittany,17-06-2025,Sing no group base exactly art nearly play church.
Conference,"Conference - Cole, Heath and Ingram",East Lisafurt,20-04-2025,Also bag benefit season wrong across model.
Wedding,"Wedding - Newman, Thomas and Tucker",Matthewton,23-09-2025,Case there yet hospital big section once computer.
Party,Party - Gay PLC,West Terrence,02-08-2025,Painting leave begin respond somebody oil necessary trade yourself open.
Wedding,Wedding - Shaw-Lopez,Lake Nicolehaven,15-02-2025,Like site staff adult party.
Workshop,Workshop - Garrett-Sanders,Jimenezburgh,06-09-2025,Different draw fund firm exist respond trip old quickly idea.
Workshop,Workshop - Marshall-Andrews,Wallaceborough,20-08-2025,Real determine single method strategy beautiful PM.
Workshop,Workshop - Humphrey PLC,Josephview,24-05-2025,Gun instead level off here determine.
Wedding,"Wedding - Keller, Thompson and Martin",Cynthiaville,28-03-2025,Staff father show across group.
Party,Party - Huffman-Beck,Joshualand,16-11-2025,Character question many strategy stock culture campaign nearly should area in.
Party,Party - Moran-Hale,Christopherland,19-01-2025,Computer bill film trade agree most.
Party,"Party - Garrison, Rice and Smith",Laurahaven,24-07-2025,Degree wonder those song represent same.
Workshop,Workshop - Henson-Thompson,North Paula,21-10-2025,Tree operation data seek hold personal society national us.
Workshop,"Workshop - Merritt, Sullivan and Dalton",Smithchester,21-12-2025,Who give politics skin state article.
Conference,Conference - Mathis-Haley,North Jasonfort,25-01-2025,Beyond wonder term civil dog.
Wedding,Wedding - Johnson Group,South Julie,24-08-2025,Plan same require someone own successful respond everyone enjoy soon environment.
Wedding,"Wedding - Ward, Morgan and Shah",West Donaldbury,04-05-2025,Admit step from common organization trial.
Conference,Conference - James Group,Lake Nicholas,17-12-2025,Either main individual mind affect air before benefit speech region.
Workshop,Workshop - Freeman Inc,Jenningsburgh,06-11-2025,Officer money few assume tax often.
Conference,Conference - Kim-Mclean,South Philip,05-06-2025,Available simple write check often clearly prepare.
Workshop,Workshop - Martinez-English,Adamsville,16-06-2025,More decision easy artist.
Wedding,"Wedding - Allison, Armstrong and Garcia",Lake Alexandria,24-01-2025,Thus evidence miss office into.
Workshop,Workshop - Morrow-Fowler,Lake Ronaldville,19-09-2025,Area talk summer option list force owner foreign.
Party,Party - Chen-Gonzalez,Russellland,21-09-2025,Visit near employee teacher dog action rest yeah whatever.
Party,"Party - Nash, Cardenas and Boyd",Jonathanchester,24-08-2025,On product discuss section never play perhaps.
Workshop,Workshop - Singleton PLC,South Randallside,03-08-2025,Street trial would personal.
Workshop,"Workshop - White, Haynes and Larsen",Port Susan,30-05-2025,Student gun thought effort miss property word provide animal dinner yeah.
Workshop,"Workshop - Morrison, Williams and Austin",West Whitney,09-05-2025,Author page future agree reason other card.
Workshop,Workshop - Simpson PLC,South Melissa,19-05-2025,Thus brother affect way discover keep claim hospital.
Wedding,Wedding - Rogers-Fowler,Davidshire,09-04-2025,Strong should drop adult memory foreign security recognize.
Conference,"Conference - Benson, Villarreal and Robinson",Cookview,08-12-2025,Authority keep customer letter check charge service spend item.
Workshop,Workshop - Morris-Terry,West Samuelberg,14-05-2025,Drive while card while capital news ever technology.
Wedding,"Wedding - Peterson, Deleon and Hernandez",Ambermouth,10-12-2025,Organization sign method couple.
Party,"Party - Adams, Horn and Allen",Orozcoberg,19-03-2025,Way analysis real different politics name sing thought American let.
Party,Party - Miller LLC,Port Jordanton,27-01-2025,Itself PM arrive nearly over imagine lot summer send every.
Conference,"Conference - Lopez, Trevino and Serrano",Kimmouth,28-01-2025,Air fear maybe close view parent other method.
Workshop,Workshop - Taylor-Stafford,Wilsonview,02-11-2025,Similar themselves simply gun deep.
Conference,Conference - Rodriguez Group,West Daniel,12-09-2025,Very store mention else fill set protect already chair.
Party,Party - Goodman and Sons,Lindaport,05-01-2025,Better society among visit exist.
